Timestamp,Manual_Change,Ref_Page,Ref_Sentence,Source_Name,Source_Receptor,Source_State,Target_Name,Target_Receptor,Target_State,Product_Name,Edge_Effect,Edge_TargetProliferation,Edge_ImmuneProcess,Notes,Insufficient_Detail,Location,Species,Disease,
11/7/2018 23:49:28,,470,"Right panels: activated dendritic cells also produce the cytokines IL-12 and IL-18, whose combined effect on CD8 T cells rapidly induces the production of IFN-? (upper right panel). This activates macrophages for the destruction of intracellular bacteria and can promote antiviral responses in other cells (lower right panel).",IL18,,,T_CD8,,,IFNg,Activate,,Licensing; Antibacterial; Antiviral,,,,,,
10/9/2018 9:54:07,,812,Table Appendix III,IL19,,,Monocyte,IL20Ra+IL10Rbc,,"IL6, TNFa",Activate,,,,,,,,
10/9/2018 9:31:28,,811,Table Appendix III,IL1a,,,Macrophage,"CD121a, CD121b",,,Activate,,,,,,,,
10/9/2018 9:31:12,,811,Table Appendix III,IL1a,,,T,"CD121a, CD121b",,,Activate,,,,Target_Name,,,,
10/9/2018 9:31:51,,811,Table Appendix III,IL1b,,,Macrophage,"CD121a, CD121b",,,Activate,,,,,,,,
10/9/2018 9:31:43,,811,Table Appendix III,IL1b,,,T,"CD121a, CD121b",,,Activate,,,,Target_Name,,,,
10/9/2018 12:43:53,,111,Figure 3.27  Activates vascular endothelium Activates lymphocytes Local tissue destruction Increases access of effector cells,IL1b,,,Endothelial_vascular,,,,Activate,,Inflammation,,,,,,
10/21/2018 19:59:00,,452,"ILC3s play a critical early role in defense against extracellular bacteria and fungi at barrier tissues. Similarly toTH17 cells, ILC3s are responsive to IL-23 and IL-1?; these cytokines elicit the production of IL-17 and IL-22, which promote early type 3 responses.",IL1b,,,ILC3,,,,Activate,,Type 3; Anti-EC bacteria; Antifungal,,,Barrier tissues,,,
10/9/2018 17:11:58,,120,"The effects of TNF-à, IL-1?, and IL-6 are summarized in Fig. 3.33. One of the most important of these occurs in the liver and is the initiation of a response known as the acute-phase response (Fig. 3.34). The cytokines act on hepatocytes, which respond by changing the profile of proteins that they synthesize and secrete into the blood. In the acute-phase response, blood levels of some proteins go down, whereas levels of others increase markedly. The proteins induced by TNF-à, IL-1?, and IL-6 are called the acute-phase proteins.",IL1b,,,Hepatocyte,,,Acute phase proteins,Activate,,Fever,,,Liver,,,
10/9/2018 17:15:53,,120,"IL-1?, IL-6, and TnF-à activate hepatocytes to synthesize acute-phase proteins, and bone marrow endothelium to release neutrophils.",IL1b,,,Hepatocyte,,,acute phase proteins,Activate,,Fever,,,Liver,,,
10/9/2018 19:49:46,,125,"ILC3s respond to the cytokines IL-1? and IL-23 and produce several cytokines, including IL-17 and IL-22, which increase defenses against extracellular bacteria and fungi.",IL1b,,,ILC3,,,"IL17, IL22",Activate,,Anti-EC bacteria; Antifungal,,,,,,
10/9/2018 17:17:02,Target_Name,120,"IL-1?, IL-6, and TnF-à activate hepatocytes to synthesize acute-phase proteins, and bone marrow endothelium to release neutrophils.",IL1b,,,Hematopoietic,,,Neutrophil,Polarize,,Fever; Hematopoiesis,,,,,Infection,
10/9/2018 9:33:28,,811,Table Appendix III,IL2,,,T,"CD25a, CD122b, CD132",,,Polarize,Yes,,,Target_Name,,,,
10/9/2018 9:32:53,,811,Table Appendix III,IL2,,,T_reg,"CD25a, CD122b, CD132",,,Survive,,,,,,,,
10/16/2018 11:01:59,,284,"In T cells, one of the major functions of NFAT, AP-1, and NF?B is to act together to stimulate expression of the gene for the cytokine IL-2, which is essential for promoting T-cell proliferation and differentiation into effector cells.",IL2,,,T,,,T (effector),Activate,Yes,,,"Product_Name, Target_Name",,,,
10/17/2018 13:00:15,Target_Name,335,"Thymically derived Treg cells are a subset of CD4+ T cells that function to maintain self-tolerance. These cells arise from CD4+CD8+ thymocytes, as do conventional T cells. During their maturation, they upregulate the transcription factor FoxP3. Treg cell development also depends on IL-2 receptor signaling, a cytokine signal that is not required for the development of conventional T cells.",IL2,,,T,,,T_reg,Polarize,,,,Target_Name,,,,
10/18/2018 14:21:53,,368,"However, in vivo studies indicate that while IL-2 can augment T-cell proliferation and survival, in many cases it is dispensable and other functions of IL-2 might be more important.",IL2,,,T,,,,Survive,Yes,,,Target_Name,,,,
10/18/2018 14:22:18,,368,"In particular, IL-2 is essential for the maintenance of regulatory T cells, which do not produce their own IL-2 when activated.",IL2,,,T_reg,,,,Survive,,,,,,,,
10/18/2018 14:22:46,Target_Name,368,"IL-2 also appears to affect the balance of effector and memory T cells that develop in a primary response to antigen, as will be discussed in Chapter 11.",IL2,,,T (effector),,,,Polarize,,,,Target_Name,,,,
10/18/2018 14:28:32,,369,Activated T cells secrete and respond to IL-2. Activation of naive T cells induces the expression and secretion of IL-2 and the expression of high-affinity IL-2 receptors. IL-2 binds to the high-affinity IL-2 receptors to enhance T-cell growth and differentiation.,IL2,,,T_CD4,,Activated,,Activate,Yes,,,,,,,
10/18/2018 14:28:43,Target_Name,369,Activated T cells secrete and respond to IL-2. Activation of naive T cells induces the expression and secretion of IL-2 and the expression of high-affinity IL-2 receptors. IL-2 binds to the high-affinity IL-2 receptors to enhance T-cell growth and differentiation.,IL2,,,T_CD8,,Activated,,Polarize,Yes,,,,,,,
10/18/2018 14:30:12,,369,"The binding of IL-2 by these activated naive T cells triggers signaling that supports their activation and differentiation, and can enhance their proliferation (Fig. 9.24).",IL2,,,T_CD4,,Activated,,Survive,Yes,,,,,,,
10/18/2018 14:30:21,,369,"The binding of IL-2 by these activated naive T cells triggers signaling that supports their activation and differentiation, and can enhance their proliferation (Fig. 9.24).",IL2,,,T_CD8,,Activated,,Survive,Yes,,,,,,,
10/18/2018 14:25:40,Target_Name,369,IL-2 modulates T-cell differentiation and enhances proliferation,IL2,,,T_CD4,,Activated,,Polarize,Yes,,,,,,,
10/18/2018 14:25:49,Target_Name,369,IL-2 modulates T-cell differentiation and enhances proliferation,IL2,,,T_CD8,,Activated,,Polarize,Yes,,,,,,,
10/18/2018 14:52:25,,371,Figure 9.26,IL2,,,T_CD8,,Activated,,Polarize,Yes,,,,,,,
10/18/2018 15:00:06,,372,The CD4 T cells also produce abundant IL-2 and thus help drive CD8 T-cell proliferation. This may in turn activate the CD8 T cell to make its own IL-2.,IL2,,,T_CD8 ,,,,Survive,Yes,CD4:CD8 Crosstalk,,,,,,
10/18/2018 15:06:58,,372,"In some viral infections, dendritic cells become sufficiently activated to directly induce CD8 T cells to produce the IL-2 required for their differentiation into cytotoxic effector cells, without help from CD4 T cells.",IL2,,,T_CD8,,Activated,T_Cytotoxic,Polarize,,,,,,,,
10/19/2018 10:26:05,Target_Name,375,"When pathogens are absent, the presence of TGF-? and IL-2, and the lack of IL-6, favor the development of induced Treg cells.",IL2,,,T_CD4,,,Treg,Polarize,,,,,,,,
10/19/2018 19:42:53,,379,"Similarly, by expressing CD25, and thus the high-affinity receptor for IL-2, and lacking the ability to produce IL-2, Treg cells appear to sequester IL-2 from naive T cells, which lack CD25 expression until fully activated.",IL2,,,T_reg,,,,Activate,,Immunosuppression,Mechanism of immunosuppression: sequester IL2 from naive T,,,,,
10/18/2018 16:32:16,,385,Table Figure 9.4,IL2,,,B,,,,Activate,Yes,,,,,,,
10/18/2018 16:32:38,,385,Table Figure 9.4,IL2,,,T,,,,Polarize,Yes,,,Target_Name,,,,
10/18/2018 16:33:07,,385,Table Figure 9.4,IL2,,,NK,,,,Activate,Yes,,,,,,,
11/19/2018 14:08:42,,483,The mechanism underlying this requirement for CD4 T cells is not completely understood. It may involve two types of signals received by the CD8 T cell? those received through CD40 and those received through the IL-2 receptor... The requirement for IL-2 signaling in programming CD8 memory was discovered by using CD8 T cells that were unable to respond to IL-2 because of a genetic deiciency in the IL-2Rà subunit,IL2,,,T_CD8,,,T_CD8_memory,Activate,,,,,,,,
10/18/2018 17:03:53,,372,The IL-2 produced by activated CD4 T cells also acts to promote effector CD8 T-cell differentiation.,IL2,,Activated,T_CD8,,,T_Cytotoxic,Polarize,,CD4:CD8 Crosstalk,,,,,,
10/20/2018 15:58:17,,460,IL-2 produced by TH1 cells acts on naive CD4 and CD8 T cells  Figure 11.12 Alters balance of TH1 versus TFH differentiation to favor TH1; supports expansion of CD8 CTLs,IL2,,,T_CD4,,,Th1,Polarize,,Type 1; Anti-IC bacteria,,,,,,
10/20/2018 15:58:49,,460,IL-2 produced by TH1 cells acts on naive CD4 and CD8 T cells  Figure 11.12 Alters balance of TH1 versus TFH differentiation to favor TH1; supports expansion of CD8 CTLs,IL2,,,T_CD8,,,T_Cytotoxic,Activate,Yes,Type 1; Anti-IC bacteria,,,,,,
10/9/2018 9:55:13,,812,Table Appendix III,IL20,,,Keratinocyte,IL20RA+IL10Rbc; IL22Rac_IL10Rbc,,,Activate,Yes,,,,,,,
10/9/2018 9:57:05,,812,Table Appendix III,IL21,,,T,IL21R CD132,,,Activate,Yes,,,Target_Name,,,,
10/9/2018 9:57:14,,812,Table Appendix III,IL21,,,NK,IL21R CD132,,,Activate,Yes,,,,,,,
10/9/2018 9:56:44,,812,Table Appendix III,IL21,,,B,IL21R+CD132,,,Activate,Yes,,,,,,,
11/20/2018 11:29:36,,506,"The subsequent expansion and differentiation of IgA-switched B cells are driven by IL-5, IL-6, IL-10, and IL-21.",IL21,,,B,,Activated,"IgA, B_Plasma",Activate,Yes,Class switching,,,Gut,,,
10/19/2018 21:05:00,,401,"This occurs when antigen bound by surface immunoglobulin on the B cell is internalized and degraded within the B cell and peptides derived from it are returned to the cell surface in a complex with MHC class II molecules (see Fig. 10.2, first panel). When the TFH cell recognizes these peptide:MHC complexes, it provides the B cell with signals that favor survival and induce proliferation. These signals include the activation of CD40 on B cells by TFH expression of its ligand, CD40L (CD154), and production of various cytokines by TFH cells, including IL-21 (Fig. 10.3).",IL21,,,B,,,,Activate,Yes,Antibody production,,,,,,
10/19/2018 21:11:46,,401,"Besides expression of CD40 ligand, the TFH cell secretes several important cytokines. Included among them is IL-21, which activates the transcription factor STAT3 to enhance B-cell proliferation and survival.",IL21,,,B,,,,Survive,Yes,Antibody production,,,,,,
10/19/2018 21:06:37,,401,IL-21 signaling activates STAT3 and enhances cellular proliferation and differentiation into plasma cells and memory B cells.,IL21,,,B,,,,Activate,Yes,,,,,,,
10/19/2018 21:06:57,,401,IL-21 signaling activates STAT3 and enhances cellular proliferation and differentiation into plasma cells and memory B cells.,IL21,,,B,,,"B_Plasma, B_Memory",Polarize,Yes,,,,,,,
10/19/2018 22:39:39,,406,"Primary among these is IL-21, which is produced early in immune responses by TFH cells and which activates the transcription factor STAT3 in B cells to support proliferation and differentiation. IL-21 exerts similar autocrine effects on TFH cells.",IL21,,,B,,,,Activate,Yes,Antibody production,,,,,,
10/19/2018 22:39:48,,406,"Primary among these is IL-21, which is produced early in immune responses by TFH cells and which activates the transcription factor STAT3 in B cells to support proliferation and differentiation. IL-21 exerts similar autocrine effects on TFH cells.",IL21,,,Tfh,,,,Activate,Yes,Antibody production,,,,,,
10/19/2018 23:06:19,,411,"B cells that present linked antigen epitopes to TFH cells will receive help through CD40L and IL-21, which promote survival and proliferation.",IL21,,,B,,,,Survive,Yes,Antibody production,,,,,,
10/19/2018 23:25:14,,421,"Follicular helper T cells stimulate B cells by conjugation in germinal centers, with binding of CD40 ligand on the T cell to CD40 on the B cell, and by their release of cytokines, such as IL-21.",IL21,,,B,,,,Activate,,Antibody production,,,,,,
10/19/2018 23:15:19,,418,"TFH cells also produce IL-21, which promotes switching to IgG1 and IgG3.",IL21,,,B,,,"IgG1, IgG3",Polarize,,Class switching; Antibody production,,,,,,
10/19/2018 10:55:26,,377,"In addition to production of low amounts of cytokines characteristic of the effector T-cell subsets with which they develop in parallel (for example, IFN-?, IL-4, or IL-17), and which promote different patterns of B-cell class switching, TFH cells produce high amounts of IL-21, a cytokine that supports the proliferation and differentiation of B cells into antibody-producing plasma cells.",IL21,,,T,,,B_Plasma,Activate,Yes,Class switching,,Target_Name,,,,
10/9/2018 9:58:12,,812,Table Appendix III,IL22,,,Hepatocyte,IL22Rac+IL10Rbc,,"acute phase proteins, pro-inflammatory agents",Activate,,Inflammation,,,Liver,,,
10/19/2018 9:57:15,,373,"TH17 cells also produce IL-22, which along with IL-17 can activate epithelial cells at the barrier site to produce antimicrobial peptides that kill bacteria.",IL22,,,Epithelial_barrier,,,antimicrobial peptides,Activate,,Antibacterial,,,Barrier tissues,,,
10/9/2018 19:51:10,,125,"IL-17 functions by stimulating the production of chemokines that recruit neutrophils, while IL-22 acts directly on epithelial cells to stimulate the production of antimicrobial peptides such as RegIII? (see Section 2-4).",IL22,,,Epithelial,,,Antimicrobial peptides; RegIIIg,Activate,,Anti-EC bacteria; Antifungal,,,,,,
10/21/2018 20:01:47,,452,IL-22 acts on epithelial cells to induce their production of antimicrobial peptides (AMPs) and promote enhanced barrier integrity.,IL22,,,Epithelial_barrier,,,antimicrobial peptides,Activate,,Type 3; Barrier integrity,,,,,,
10/24/2018 12:46:00,Target_Name,466,"TH17 cells also produce IL-22, a member of the IL-10 family that acts cooperatively with IL-17 to induce the expression by epithelial cells of antimicrobial proteins (see Fig. 11.16). These include ?-defensins and the C-type lectins RegIII? and RegIII?, all of which can directly kill bacteria (see Section 2-4).",IL22,,,Epithelial_barrier,,,"b-defensins, C type lectins RegIIIb and RegIIIg",Activate,,Anti-EC bacteria; Antifungal,,,,,,
12/4/2018 15:34:34,,519,"Mucus is crucially important in protecting the epithelial barrier, and its production by goblet cells is enhanced by CD4 T-cell-derived cytokines such as IL-13 and IL-22, as well as by products of mast cells and other innate effector cells recruited by T cells.",IL22,,,Goblet,,,Mucus,Activate,,Barrier immunity,,,Intestinal epithelium,,,
12/4/2018 15:31:13,,519,"In addition to its ability to stimulate antimicrobial peptide production by Paneth cells, IL-22 produced by TH17 cells contributes to defense against extracellular bacteria and fungi by enhancing the tight junctions between epithelial cells that keep the barrier intact.",IL22,,,Epithelial_intestine,,,,Activate,,Antibacterial; Antifungal; Barrier integrity,,,Intestinal epithelium,,,
12/4/2018 16:29:14,,522,IL-22 also tightens the epithelial barrier.,IL22,,,Epithelial_intestine,,,,Activate,,Tolerance; Barrier integrity,Microbiome tolerance,,Intestinal epithelium,,,
12/4/2018 16:15:36,,522,"In addition, stimulation of pattern recognition receptors on Paneth cells induces the production of antimicrobial peptides such as RegIII? and defensins (see Section 2-4), which are also stimulated by IL-22 derived from TH17 CD4 T cells and ILC3s.",IL22,,,Paneth,,,Antimicrobial peptides,Activate,,Tolerance; Barrier integrity,Microbiome tolerance,,Intestinal epithelium,,,
12/1/2018 22:20:39,,510,"Effector TH17 cells are prominent in the intestinal mucosa, and their products are important components of local immune defense. IL-17 is needed for full expression of the poly-immunoglobulin receptor involved in secretion of IgA into the lumen, while IL-22 stimulates intestinal epithelial cells to produce antimicrobial peptides that help maintain epithelial barrier integrity.",IL22,,,Epithelial_intestine,,,antimicrobial peptides,Activate,,Barrier integrity,,,Intestinal epithelium,,,
10/24/2018 12:47:56,Target_Name,466,IL-22 also stimulates the proliferation and shedding of epithelial cells as a mechanism to deprive bacteria and fungi of a ?foothold? for colonization at epithelial surfaces.,IL22,,,Epithelial_barrier,,,,Activate,Yes,Anti-EC bacteria; Antifungal,,,,,,
12/4/2018 15:14:31,,517,"Certain specialized populations of epithelial cells have particularly important roles in innate immune defense of the intestine. Paneth cells are found only in the small intestine, where they produce antimicrobial peptides such as RegIII? and defensins when exposed to IL-22 released by CD4 TH17 cells or ILC3s.",IL22,,,Paneth,,,Antimicrobial peptides,Activate,,,gut/intestine ONLY,,Intestine,,,
12/1/2018 22:25:37,,510,"In response to IL-23 secreted by local dendritic cells, ILC3s produce IL-22, which stimulates the epithelium to generate antimicrobial peptides that promote local defense against bacterial and fungal pathogens in the intestine.",IL22,,,Epithelial_intestine,,,antimicrobial peptides,Activate,,Antibacterial; Antifungal,,,Lamina propria,,,
10/20/2018 16:36:05,,465,IL-17 and IL-22 produced by TH17 cells induce the production of antimicrobial peptides by epithelial cells  ->  Direct killing or growth inhibition of bacteria attached to the epithelium,IL22,,,Epithelial_barrier,,,antimicrobial peptides,Activate,,Type 3; Anti-EC bacteria,,,Barrier tissues,,,
10/20/2018 16:39:01,,465,IL-22 produced by TH17 increases epithelial cell turnover,IL22,,,Epithelial_barrier,,,,Activate,Yes,Type 3; Anti-EC bacteria,,,Barrier tissues,,,
10/18/2018 16:43:34,,385,Table Figure 9.4,IL22,,,Epithelial,,,antimicrobial peptides,Activate,,,,,Barrier tissues,,,
10/19/2018 10:11:50,,374,"Cytokines produced by TH17 cells, including IL-17 and IL-22, are also important in activating barrier epithelial cells in the gastrointestinal, respiratory, and urogenital tracts and the skin, to produce antimicrobial peptides that resist microbial invasion.",IL22,,,Epithelial_barrier,,,antimicrobial peptides,Activate,,Barrier immunity; Antimicrobial,,,Barrier tissues,,,
10/9/2018 9:59:00,,812,Table Appendix III,IL23,,,Th17_memory,IL12Rb1+IL23R,,,Activate,Yes,,,,,,,
10/21/2018 19:58:49,,452,"ILC3s play a critical early role in defense against extracellular bacteria and fungi at barrier tissues. Similarly toTH17 cells, ILC3s are responsive to IL-23 and IL-1?; these cytokines elicit the production of IL-17 and IL-22, which promote early type 3 responses.",IL23,,,ILC3,,,,Activate,,Type 3; Anti-EC bacteria; Antifungal,,,Barrier tissues,,,
10/18/2018 14:16:33,,368,Figure 9.22,IL23,,,T_CD4,,,,Polarize,,,,,,,,
10/19/2018 10:24:55,,375,"IL-6 produced by dendritic cells acts with transforming growth factor-? (TGF-?) to induce differentiation of TH17 cells, which upregulate expression of the IL-23 receptor and become responsive to IL-23.",IL23,,,Th17,,,,Activate,,Type 3,,,,,,
10/19/2018 10:43:49,,376,"Developing TH17 cells express the receptor for the cytokine IL-23, rather than the IL-12 receptor typical of TH1 cells, and the expansion and further development of TH17 effector activity seem to require IL-23, similar to the requirement for IL-12 in effective TH1 responses (see Figs. 9.31 and 9.32).",IL23,,,Th17,,,,Activate,Yes,Type 3,,,,,,
12/4/2018 16:47:16,,524,Figure 12.23,IL23,,,T_CD4,,,Th17,Polarize,,Microbiome tuning of immune response; Type 3,,,Gut,,,
10/20/2018 17:04:28,,448,Figure 11.3,IL23,,,ILC3,,,,Activate,,Anti-EC bacteria,,,,,,
10/22/2018 15:47:27,,457,Figure 11.9,IL23,,,T_CD4,,,Th17,Polarize,,,,,,,,
10/9/2018 19:40:49,,124,Table Figure 3.37,IL23,,,ILC3,,,"IL22, IL17",Activate,,Anti-EC bacteria; Antifungal,,,,,,
10/9/2018 19:49:58,,125,"ILC3s respond to the cytokines IL-1? and IL-23 and produce several cytokines, including IL-17 and IL-22, which increase defenses against extracellular bacteria and fungi.",IL23,,,ILC3,,,"IL17, IL22",Activate,,Anti-EC bacteria; Antifungal,,,,,,
10/9/2018 19:41:01,,124,Table Figure 3.37,IL23,,,LTi,,,"IL22, IL17",Activate,,Anti-EC bacteria; Antifungal,,,,,,
10/24/2018 12:55:03,,466,Figure 11.17,IL23,,,Th17,,,,Activate,Yes,,,,,,,
10/24/2018 13:17:49,,466,"These initial conditions are not, however, sufficient to generate complete or effective TH17 or TH1 responses. In addition, each T-cell subset also requires stimulation by another cytokine: IL-23 in the case of TH17 cells, and IL-12 in the case of TH17 cells.",IL23,,,Th17,,,,Activate,,,,,,,,
10/24/2018 13:19:34,,467,"IL-23 and IL-12 amplify the activities of TH17 and TH1 cells, respectively.",IL23,,,Th17,,,,Activate,,,,,,,,
10/24/2018 13:21:34,,467,"IL-23 does not initiate the commitment of naive CD4 T cells to become TH17 cells, but it does stimulate their expansion and contributes to their maintenance.",IL23,,,Th17,,,,Survive,Yes,,,,,,,
10/24/2018 13:48:38,,467,"Similarly, stimulation of TH2 and ILC2 cells by TSLP (STAT5) plus IL-33 produces IL-5 and IL-13, and both TH17 and ILC3 cells stimulated by IL-23 (STAT3) plus IL-1 produce IL-17 and IL-22. ",IL23,,,Th17,,,"IL17, IL22",Activate,,,IL23 plus IL1,,,,,
10/24/2018 13:50:09,,467,"Similarly, stimulation of TH2 and ILC2 cells by TSLP (STAT5) plus IL-33 produces IL-5 and IL-13, and both TH17 and ILC3 cells stimulated by IL-23 (STAT3) plus IL-1 produce IL-17 and IL-22. ",IL23,,,ILC3,,,"IL17, IL22",Activate,,,IL23 plus IL1,,,,,
11/7/2018 22:58:09,,468,"Moreover, repetitive restimulation of TH17 cells with the TH17 lineage cytokine IL-23 could lead to a subset of progeny that also acquired features of TH1 cells.",IL23,,,Th17,,,,Polarize,,,Experiment done in reporter mice,,,,,
10/24/2018 13:54:04,,468,Figure 11.19,IL23,,,Th17,,,"IL17, IL22",Activate,,,IL23 plus IL1,,,,,
12/4/2018 16:55:53,,524,"IL-23 and IL-12 in concert can also induce inflammatory TH1 responses in the intestine, with some CD4 effector T cells found to produce both IFN-? and IL-17 under these circumstances.",IL23,,,Th1,,,,Activate,,Antimicrobial; Inflammation,Systemic immune responses against microbiota,,Intestine,,,
12/4/2018 16:54:46,Target_Name,524,"IL-23 is important in this process, promoting differentiation of TH17 effector cells.",IL23,,,T_CD4,,,Th17,Polarize,,Antimicrobial,Systemic immune responses against microbiota,,Intestine,,,
12/1/2018 22:24:59,,510,"In response to IL-23 secreted by local dendritic cells, ILC3s produce IL-22, which stimulates the epithelium to generate antimicrobial peptides that promote local defense against bacterial and fungal pathogens in the intestine.",IL23,,,ILC3,,,,Activate,,Antibacterial; Antifungal,,,Lamina propria,,,
10/24/2018 12:36:13,Target_Name,465,"As discussed in Chapter 9, the development of TH17 cells is induced by the combined actions of TGF-? and the pro-inflammatory cytokines IL-6, IL-1, and IL-23 (see Fig. 9.31).",IL23,,,T_CD4,,,Th17,Polarize,,Anti-EC bacteria; Antifungal,,,,,,
11/20/2018 11:00:19,,503,"In mice, the most abundant subset of dendritic cells in the Peyer?s patch expresses CD11b (àM integrin) and, when activated, tends to produce IL-23. This promotes development of TH17 cells and stimulates ILC3 cells, both of which produce IL-17 and IL-22 (see Sections 3-23 and 11-2).",IL23,,,ILC3,,,"IL17, IL22",Activate,,,,,Peyers patch,,,
10/9/2018 9:59:38,,812,Table Appendix III,IL25,,,Th2,IL17BR,,Th2 cytokines,Activate,,,,,,,,
12/6/2018 12:51:22,,622-623,"Allergens can also stimulate the airway epithelium directly, through TLRs and other damage receptors, to release IL-25 and IL-33. These cytokines can lead to the activation of submucosal type 2 innate lymphoid cells (ILC2s), inducing them to release IL-4, IL-5, IL-9, and IL-13.",IL25,,,ILC2,,,"IL4, IL5, IL9, IL13",Activate,,Type 2,,,Airway,,Asthma (allergic asthma),
10/20/2018 17:04:06,,448,Figure 11.3,IL25,,,ILC2,,,,Activate,,Antiparasitic,,,,,,
10/9/2018 19:39:54,,124,Table Figure 3.37,IL25,,,ILC2,,,"IL5, IL13",Activate,,Antiparasitic,,,,,,
10/21/2018 19:50:38,,451,"ILC2s that reside in mucosal tissues are preferentially activated by the cytokines thymic stromal lymphopoietin (TSLP), a STAT5-activating cytokine, and IL-33 or IL-25, each of which are produced in response to helminths. These cytokines are primarily produced by epithelial cells that sense molecular patterns common to helminths, such as chitin, a polysaccharide polymer of ?-1,4-N-acetylglucosamine that is a widespread constituent of helminths, the exoskeletons of insects, and some fungi.",IL25,,,ILC2,,,,Activate,,Type 2; Antiparasitic,,,Mucosa,,,
10/24/2018 12:32:08,,464,The innate cytokines IL-25 and IL-33 also activate mucosal mast cells early in a response to helminths.,IL25,,,Mast,,,,Activate,,Antiparasitic,,,Mucosa,,,
10/9/2018 10:00:28,,812,Table Appendix III,IL26,,,Epithelial,IL20Ra+IL10Rbc,,,Activate,,Inflammation,,,,,,
12/4/2018 22:13:23,Target_Name,604,"Exposure to IL-4, IL-5, IL-9, and IL-13 favors the development of TH2 cells, whereas exposure to IFN-? and IL-12 (and its relative IL-27) favors TH1-cell development.",IL27,,,T_CD4,,,Th1,Polarize,,Type 1,,,,,,
12/5/2018 16:19:04,Target_Name,611,"Other immunoregulatory molecules that might serve as immunotherapeutic agents for treatment of asthma include the cytokines IL-35 and IL-27, which, like IL-10, can inhibit TH2 responses.",IL27,,,T_CD4,,,NOT Th2,Inhibit,,Immunosuppression,Asthma treatment,,,,,
1/8/2019 Manual Split,,812,Table Appendix III,IL27,,,T,,,IL12R; IL10,Activate,,,,Target_Name,,,,
12/6/2018 12:17:40,Target_Name,617,"Basophils are also present at the site of an inflammatory reaction, and growth factors for basophils are very similar to those for eosinophils; they include IL-3, IL-5, and GM-CSF.",IL3,,,Hematopoietic,,,Basophil,Polarize,Yes,Hematopoiesis,,,,,,
10/20/2018 16:08:26,Target_Name,460,IL-3 and GM-CSF stimulate the production of new monocytes by acting on hematopoietic stem cells in the bone marrow.,IL3,,,Hematopoietic,,,Monocyte,Polarize,,Type 1; Anti-IC bacteria; Hematopoiesis,,,BM,,,
