Timestamp,Manual_Change,Ref_Page,Ref_Sentence,Source_Name,Source_Receptor,Source_State,Target_Name,Target_Receptor,Target_State,Product_Name,Edge_Effect,Edge_TargetProliferation,Edge_ImmuneProcess,Notes,Insufficient_Detail,Location,Species,Disease,
10/9/2018 19:52:25,,125,"NK cells kill cells by releasing their cytotoxic granules, which are similar to those of cytotoxic T cells and have the same effects (discussed in Chapter 9). In brief, the contents of cytotoxic granules, which contain granzymes and the pore-forming protein perforin, are released onto the surface of the target cell, and penetrate the cell membrane and induce programmed cell death.",NK,,Activated,Granzymes,,,,Secrete,,Cytotoxicity,,,,,,
10/10/2018 9:35:05,,126,"IL-12, acting in synergy with the cytokine IL-18 produced by activated macrophages, can also stimulate NK cells to secrete large amounts of interferon (IFN)-?, and this is crucial in controlling some infections before the IFN-? produced by activated CD8 cytotoxic T cells becomes available.",NK,,,IFNg,,,,Secrete,,,Pre-T response infection control,,,,,
10/10/2018 9:36:56,,126,"The production of IFN-? by NK cells early in an immune response can directly activate macrophages to enhance their capacity to kill pathogens, augmenting innate immunity, but also influences adaptive immunity through actions on dendritic cells and in regulating the differentiation of CD4 T cells into the pro-inflammatory TH1 subset, which produces IFN-?. NK cells also produce TNF-à, granulocyte-macrophage stimulating factor (GM-CSF), and the chemokines CCL3 (MIF 1-à), CCL4, and CCL5 (RANTES), which act to recruit and activate macrophages.",NK,,Activated,IFNg,,,,Secrete,,,,,,,,
10/10/2018 9:39:47,,126,"NK cells also produce TNF-à, granulocyte-macrophage stimulating factor (GM-CSF), and the chemokines CCL3 (MIF 1-à), CCL4, and CCL5 (RANTES), which act to recruit and activate macrophages.",NK,,,TNFa,,,,Secrete,,,,,,,,
10/10/2018 9:40:01,,126,"NK cells also produce TNF-à, granulocyte-macrophage stimulating factor (GM-CSF), and the chemokines CCL3 (MIF 1-à), CCL4, and CCL5 (RANTES), which act to recruit and activate macrophages.",NK,,,GMCSF,,,,Secrete,,,,,,,,
10/10/2018 9:40:11,,126,"NK cells also produce TNF-à, granulocyte-macrophage stimulating factor (GM-CSF), and the chemokines CCL3 (MIF 1-à), CCL4, and CCL5 (RANTES), which act to recruit and activate macrophages.",NK,,,CCL3,,,,Secrete,,,,,,,,
10/10/2018 9:40:24,,126,"NK cells also produce TNF-à, granulocyte-macrophage stimulating factor (GM-CSF), and the chemokines CCL3 (MIF 1-à), CCL4, and CCL5 (RANTES), which act to recruit and activate macrophages.",NK,,,CCL4,,,,Secrete,,,,,,,,
10/10/2018 9:40:35,,126,"NK cells also produce TNF-à, granulocyte-macrophage stimulating factor (GM-CSF), and the chemokines CCL3 (MIF 1-à), CCL4, and CCL5 (RANTES), which act to recruit and activate macrophages.",NK,,,CCL5,,,,Secrete,,,,,,,,
10/10/2018 9:42:28,,126,Stimulation of activating receptors will add to the chance that the NK cells will release cytokines such as IFN-? and activate the killing of the stimulating cell through the release of cytotoxic granules.,NK,,Activated,IFNg,,,,Secrete,,,,,,,,
10/11/2018 15:30:24,,233,"Gene expression of the classical MHC class II proteins, along with the invariant-chain, DMà, DM?, and DOà, but not DO?, is coordinately increased by IFN-?, which is produced by activated TH1 cells, CD8 T cells, and NK cells.",NK,,Activated,IFNg,,,,Secrete,,,,,,,,
10/19/2018 10:22:06,,375,"Activated group 1 ILCs, such as NK cells, may also be an important source of IFN-?.",NK,,Activated,IFNg,,,,Secrete,,,,,,,,
10/20/2018 17:02:12,,448,Figure 11.3,NK,,,IFNg,,,,Secrete,,Antiviral; Antibacterial,,,,,,
10/20/2018 17:10:23,,451,"As discussed in Chapter 3, ILC1s and related NK cells are characterized by their production of IFN-? in response to IL-12 and IL-18 produced by pathogen-activated dendritic cells and macrophages.",NK,,Activated,IFNg,,,,Secrete,,Type 1,,,,,,
10/20/2018 17:16:25,,451,"Also, similar to the effect on TH1 cells of IFN-? production by ILC1s, the production of IFN-? by activated NK cells may contribute to the enhanced differentiation of cytolytic CD8 T cells.",NK,,Activated,IFNg,,,,Secrete,,Type 1,,,,,,
10/20/2018 15:09:38,,435,"As well as this innate function, NK cells can recognize and destroy antibodycoated target cells in a process called antibody-dependent cell-mediated cytotoxicity (ADCC). This is triggered when antibody bound to the surface of a cell interacts with Fc receptors on the NK cell (Fig. 10.42). NK cells express the receptor Fc?RIII (CD16), which recognizes the IgG1 and IgG3 subclasses. The killing mechanism is analogous to that of cytotoxic T cells, involving the release of cytoplasmic granules containing perforin and granzymes (see Section 9-31). ADCC has been shown to have a role in the defense against infection by viruses, and represents another mechanism by which antibodies can direct an antigen-specific attack by an effector cell that itself lacks specificity for antigen.",NK,,Activated,Granzymes,,,,Secrete,,ADCC; Antiviral,,,,,,
11/7/2018 23:52:50,,471,"The source of this IFN-? seems to be both NK cells and naive CD8 T cells, which begin to secrete it within the first few hours after infection.",NK,,,IFNg,,,,Secrete,,,,,,,Infection,
11/19/2018 14:18:43,,486,"Several specialized subsets of immune cells, which can be viewed as intermediates between innate and adaptive immunity, act next and include the innate lymphoid cells, or ILCs, which are rapid responders to cytokines produced by innate sensor cells and can help to bias the CD4 T-cell response toward parallel subsets of effector T cells; and NK cells, which can be recruited to lymph nodes and secrete IFN-?, and thus promote a TH1 response.",NK,,,IFNg,,,,Secrete,,,,,,,,
10/21/2018 20:31:43,,544,"Because CD40 signaling is also required for the activation of dendritic cells and macrophages for optimal production of IL-12, which is important for the production of IFN-? by TH1 cells and NK cells, patients with CD40 ligand deficiency also have defects in type 1 immunity and thus manifest a form of combined immunodeficiency. ",NK,,,IFNg,,,,Secrete,,Type 1,,,,,,
10/21/2018 20:41:41,,546,"These microbes are specialized for survival within macrophages, and their eradication requires enhanced microbicidal activities induced by IFN-? produced by type 1 cells: NK cells, ILC1 cells, and TH1 cells (see Section 11-2).",NK,,,IFNg,,,,Secrete,,,,,,,,
10/20/2018 15:09:27,,435,"As well as this innate function, NK cells can recognize and destroy antibodycoated target cells in a process called antibody-dependent cell-mediated cytotoxicity (ADCC). This is triggered when antibody bound to the surface of a cell interacts with Fc receptors on the NK cell (Fig. 10.42). NK cells express the receptor Fc?RIII (CD16), which recognizes the IgG1 and IgG3 subclasses. The killing mechanism is analogous to that of cytotoxic T cells, involving the release of cytoplasmic granules containing perforin and granzymes (see Section 9-31). ADCC has been shown to have a role in the defense against infection by viruses, and represents another mechanism by which antibodies can direct an antigen-specific attack by an effector cell that itself lacks specificity for antigen.",NK,,Activated,Perforin,,,,Secrete,,ADCC; Antiviral,,,,,,
10/7/2018 12:57:25,,811,Table Appendix III,NK,,,IFNg,,,,Secrete,,"Type 1, Class switching, Antigen presentation",Suppresses Th17 and Th2,,,,,
10/7/2018 16:15:48,,812,Table Appendix III,NK,,,IL22,,,,Secrete,,Antimicrobial; Acute phase response; Inflammation; Barrier integrity,IL22 Induces production of Antimicrobial peptides; induces liver acute phase proteins; pro-inflammatory agents; epithelial barrier,,,,,
10/7/2018 13:41:57,,812,Table Appendix III,NK,,,IL17F,,,,Secrete,,Inflammation,,,,,,
10/7/2018 16:21:20,,812,Table Appendix III,NK,,,IL26,,,,Secrete,,Inflammation,,,,,,
10/7/2018 13:39:24,,812,Table Appendix III,NK,,,IL17A,,,,Secrete,,Inflammation; Antimicrobial,,,,,,
10/7/2018 16:24:30,,812,Table Appendix III,NK,,,IL32,,,,Secrete,,,,,,,,
10/9/2018 9:51:57,,812,"Induces IFN-? production by T cells and NK cells,",NK,,,IFNg,,,,Secrete,,,,,,,,
10/8/2018 11:34:16,,813,Table Appendix III,NK,,,TNFa,,,,Secrete,,Inflammation,,,,,,
12/4/2018 15:24:10,,518,"Pro-inflammatory myeloid cells also produce mediators such as IL-6, TNF-à, and nitric oxide that help drive IgA switching and secondary expansion of mucosal B cells.",NO,,,B,,,IgA,Polarize,Yes,Antibody production,,,Gut,,,
12/22/2018  Manual,,167,Additional ligands may include heat-shock proteins and nonpeptide ligands such as phosphorylated ligands or mycobacterial lipid antigens. ?:ë T cells can also respond to unorthodox nucleotides and phospholipids,Nucleotides,,,T_gd,,,,Activate,,,,,,,,
10/9/2018 10:12:17,,813,Table Appendix III,OPGL,,,BM Stromal,RANK/OPG,,,Activate,,,Stimulates osteoclasts for bone resorption,,,,,
12/7/2018 22:57:12,Source_Name,668,"The TNF family cytokine RANK ligand, expressed by T cells and fibroblasts in the inflamed joint, is the primary activator of bone-destroying osteoclasts.",OPGL,,,Osteoclast,,,,Activate,,,,,Synovial membrane,,Rheumatoid Arthritis,
10/24/2018 12:25:25,,464,"Along with other factors, ornithine increases the contractility of mucosal smooth muscle and promotes tissue remodeling and repair (see Fig. 11.15).",Ornithine,,,Smooth muscle,,,,Activate,,Antiparasitic,,,,,,
9/26/2018 14:07:14,,45,"Lysozyme is also produced by Paneth cells, specialized epithelial cells in the base of the crypts in the small intestine that secrete many antimicrobial proteins into the gut",Paneth,,,Lysozyme,,,,Secrete,,Antibacterial,,,,,,
9/26/2018 14:07:42,,45,"Paneth cells also produce secretory phospholipase A2, a highly basic enzyme that can enter the bacterial cell wall to access and hydrolyze phospholipids in the cell membrane, killing the bacteria.",Paneth,,,Secretory phospholipase A2,,,,Secrete,,Antibacterial,,,,,,
9/30/2018 14:33:36,,47,"The Paneth cells of the gut constitutively produce à-defensins, called cryptdins, which are processed by proteases such as the metalloprotease matrilysin in mice, or trypsin in humans, before being secreted into the gut lumen.",Paneth,,,Cryptdins,,,,Secrete,,,,,,,,
10/5/2018 11:03:48,,98,"NOD2 seems to have a more specialized role, being strongly expressed in the Paneth cells of the gut, where it regulates the expression of potent antimicrobial peptides such as the à- and ?-defensins",Paneth,,Activated,a-defensin,,,,Secrete,,Antibacterial,,,,,,
10/5/2018 11:04:02,,98,"NOD2 seems to have a more specialized role, being strongly expressed in the Paneth cells of the gut, where it regulates the expression of potent antimicrobial peptides such as the à- and ?-defensins",Paneth,,Activated,b-defensin,,,,Secrete,,Antibacterial,,,,,,
12/4/2018 16:14:53,,522,"In addition, stimulation of pattern recognition receptors on Paneth cells induces the production of antimicrobial peptides such as RegIII? and defensins (see Section 2-4), which are also stimulated by IL-22 derived from TH17 CD4 T cells and ILC3s.",Paneth,,Activated,RegIIIg,,,,Secrete,,Tolerance; Barrier integrity,Microbiome tolerance,,Intestinal epithelium,,,
12/23/2018 Manual split,,522,"In addition, stimulation of pattern recognition receptors on Paneth cells induces the production of antimicrobial peptides such as RegIII? and defensins (see Section 2-4), which are also stimulated by IL-22 derived from TH17 CD4 T cells and ILC3s.",Paneth,,Activated,Defensins,,,,Secrete,,Tolerance; Barrier integrity,Microbiome tolerance,,Intestinal epithelium,,,
12/4/2018 15:13:11,,517,"Certain specialized populations of epithelial cells have particularly important roles in innate immune defense of the intestine. Paneth cells are found only in the small intestine, where they produce antimicrobial peptides such as RegIII? and defensins when exposed to IL-22 released by CD4 TH17 cells or ILC3s.",Paneth,,Activated,RegIIIg,,,,Secrete,,,gut/intestine ONLY,,Intestine,,,
12/23/2018 Manual split,,517,"Certain specialized populations of epithelial cells have particularly important roles in innate immune defense of the intestine. Paneth cells are found only in the small intestine, where they produce antimicrobial peptides such as RegIII? and defensins when exposed to IL-22 released by CD4 TH17 cells or ILC3s.",Paneth,,Activated,Defensins,,,,Secrete,,,gut/intestine ONLY,,Intestine,,,
12/22/2018  Manual,,105,"Two important co-stimulatory molecules are the cell-surface proteins B7.1 (CD80) and B7.2 (CD86), which are induced on macrophages and tissue dendritic cells by innate sensors such as TLRs in response to pathogen recognition",Pathogen,,,DC,TLR,,"CD80, CD86 expression",Activate,,,,Source_Name,Tissues,,,
12/22/2018  Manual,,105,"Two important co-stimulatory molecules are the cell-surface proteins B7.1 (CD80) and B7.2 (CD86), which are induced on macrophages and tissue dendritic cells by innate sensors such as TLRs in response to pathogen recognition",Pathogen,,,Macrophage,TLR,,"CD80, CD86 expression",Activate,,,,Source_Name,Tissues,,,
10/18/2018 13:30:11,,363,"Activation of plasmacytoid dendritic cells through TLR-9 induces the expression of CD40 ligand (CD40L or CD154), a TNF-family transmembrane cytokine, which binds to CD40, a TNF-family receptor that is expressed by  activated conventional dendritic cells. This interaction enables conventional dendritic cells to sustain production of the pro-inflammatory cytokine IL-12, strengthening the IL-12-induced production of IFN-? by T cells.",pDC,CD40L,Activated,DC,CD40,Activated,IL12,Activate,,Antibacterial,,,,,,
10/9/2018 18:58:20,,122,"Also called interferon-producing cells (IPCs) or natural interferon-producing cells, human plasmacytoid dendritic cells were initially recognized as rare peripheral blood cells that accumulate in peripheral lymphoid tissues during a viral infection and make abundant type I interferons (IFN-à and IFN-?)?up to 1000 times more than other cell types.",pDC,,,IFNa,,,,Secrete,,Antiviral,,,,,,
10/9/2018 18:58:33,,122,"Also called interferon-producing cells (IPCs) or natural interferon-producing cells, human plasmacytoid dendritic cells were initially recognized as rare peripheral blood cells that accumulate in peripheral lymphoid tissues during a viral infection and make abundant type I interferons (IFN-à and IFN-?)?up to 1000 times more than other cell types.",pDC,,,IFNb,,,,Secrete,,Antiviral,,,,,,
10/18/2018 13:18:34,,362,"For example, bacterial or viral DNA containing unmethylated CpG dinucleotide motifs induces the rapid activation of plasmacytoid dendritic cells as a consequence of recognition of the DNA by TLR-9, which is present in intracellular vesicles (see Fig. 3.10). Exposure to   unmethylated DNA activates NF?B and mitogen-activated protein kinase (MAPK) signaling   pathways (see Figs. 7.19?7.21), leading to the production of pro-inflammatory cytokines such as IL-6, IL-12, IL-18, and interferon (IFN)-à and IFN-? by dendritic cells.",pDC,,Activated,IL6,,,,Secrete,,Antibacterial; Antiviral,,,,,,
10/18/2018 13:18:46,,362,"For example, bacterial or viral DNA containing unmethylated CpG dinucleotide motifs induces the rapid activation of plasmacytoid dendritic cells as a consequence of recognition of the DNA by TLR-9, which is present in intracellular vesicles (see Fig. 3.10). Exposure to   unmethylated DNA activates NF?B and mitogen-activated protein kinase (MAPK) signaling   pathways (see Figs. 7.19?7.21), leading to the production of pro-inflammatory cytokines such as IL-6, IL-12, IL-18, and interferon (IFN)-à and IFN-? by dendritic cells.",pDC,,Activated,IL12,,,,Secrete,,Antibacterial; Antiviral,,,,,,
10/18/2018 13:18:56,,362,"For example, bacterial or viral DNA containing unmethylated CpG dinucleotide motifs induces the rapid activation of plasmacytoid dendritic cells as a consequence of recognition of the DNA by TLR-9, which is present in intracellular vesicles (see Fig. 3.10). Exposure to   unmethylated DNA activates NF?B and mitogen-activated protein kinase (MAPK) signaling   pathways (see Figs. 7.19?7.21), leading to the production of pro-inflammatory cytokines such as IL-6, IL-12, IL-18, and interferon (IFN)-à and IFN-? by dendritic cells.",pDC,,Activated,IL18,,,,Secrete,,Antibacterial; Antiviral,,,,,,
10/18/2018 13:19:08,,362,"For example, bacterial or viral DNA containing unmethylated CpG dinucleotide motifs induces the rapid activation of plasmacytoid dendritic cells as a consequence of recognition of the DNA by TLR-9, which is present in intracellular vesicles (see Fig. 3.10). Exposure to   unmethylated DNA activates NF?B and mitogen-activated protein kinase (MAPK) signaling   pathways (see Figs. 7.19?7.21), leading to the production of pro-inflammatory cytokines such as IL-6, IL-12, IL-18, and interferon (IFN)-à and IFN-? by dendritic cells.",pDC,,Activated,IFNa,,,,Secrete,,Antibacterial; Antiviral,,,,,,
10/18/2018 13:19:18,,362,"For example, bacterial or viral DNA containing unmethylated CpG dinucleotide motifs induces the rapid activation of plasmacytoid dendritic cells as a consequence of recognition of the DNA by TLR-9, which is present in intracellular vesicles (see Fig. 3.10). Exposure to   unmethylated DNA activates NF?B and mitogen-activated protein kinase (MAPK) signaling   pathways (see Figs. 7.19?7.21), leading to the production of pro-inflammatory cytokines such as IL-6, IL-12, IL-18, and interferon (IFN)-à and IFN-? by dendritic cells.",pDC,,Activated,IFNb,,,,Secrete,,Antibacterial; Antiviral,,,,,,
10/18/2018 13:35:14,,363,"Plasmacytoid dendritic cells can also produce IL-12 themselves, although in smaller amounts than conventional dendritic cells do.",pDC,,,IL12,,,,Secrete,,,,,,,,
12/7/2018 22:25:08,,664,"In SLE, it is believed that  antibody:nucleic acid immune complexes containing, for example, ssRNA or dsDNA from dead cells, are bound by Fc?RIIa (green rods) on plasmacytoid dendritic cells. The Fc receptor-bound ssRNA and dsRNA are delivered to endosomes, where they activate TLR-7 and TLR-9, respectively, to induce IFN-à production (upper panel).",pDC,,Activated,IFNa,,,,Secrete,,,,,,,SLE,
10/7/2018 12:55:17,,811,Table Appendix III,pDC,,,IFNa,,,,Secrete,,Antiviral; Antigen presentation,,,,,,
12/22/2018  Manual,,167,Additional ligands may include heat-shock proteins and nonpeptide ligands such as phosphorylated ligands or mycobacterial lipid antigens. ?:ë T cells can also respond to unorthodox nucleotides and phospholipids,Phospholipids,,,T_gd,,,,Activate,,,,,,,,
10/9/2018 13:07:20,,112,Table Figure 3.28,Platelet,,,CCL5,,,,Secrete,,Inflammation,,,,,,
10/9/2018 12:50:17,,112,Table Figure 3.28,Platelet,,,CXCL7,,,,Secrete,,Inflammation; Angiogenesis,,,,,,
12/5/2018 19:21:07,,614,Table Figure 14.9,Platelet-Activating Factor,,,Neutrophil,,,,Activate,,,,,,,,
12/5/2018 19:21:26,,614,Table Figure 14.9,Platelet-Activating Factor,,,Eosinophil,,,,Activate,,,,,,,,
12/5/2018 19:21:37,,614,Table Figure 14.9,Platelet-Activating Factor,,,Platelet,,,,Activate,,,,,,,,
12/5/2018 20:14:58,,616,Table Figure 14.10,Platelet-Activating Factor,,,Neutrophil,,,,Activate,,,,,,,,
12/5/2018 20:15:10,,616,Table Figure 14.10,Platelet-Activating Factor,,,Eosinophil,,,,Activate,,,,,,,,
12/5/2018 20:15:20,,616,Table Figure 14.10,Platelet-Activating Factor,,,Platelet,,,,Activate,,,,,,,,
10/3/2018 20:14:35,,89,Table Figure 3.10,Profilin,,,Macrophage,TLR,,,Activate,,Antibacterial; Antiparasitic,"Source from toxoplasma gondii, unpathogenic bacteria. Target_Receptor = TLR11",,,Mouse,,
10/3/2018 20:15:21,,89,Table Figure 3.10,Profilin,,,DC,TLR,,,Activate,,Antibacterial; Antiparasitic,"Source from toxoplasma gondii, unpathogenic bacteria. Target_Receptor = TLR11",,,Mouse,,
10/3/2018 20:15:35,,89,Table Figure 3.10,Profilin,,,Epithelial,TLR,,,Activate,,Antibacterial; Antiparasitic,"Source from toxoplasma gondii, unpathogenic bacteria. Target_Receptor = TLR11",,,Mouse,,
10/3/2018 20:15:46,,89,Table Figure 3.10,Profilin,,,Hepatocyte,TLR,,,Activate,,Antibacterial; Antiparasitic,"Source from toxoplasma gondii, unpathogenic bacteria. Target_Receptor = TLR11",,Liver,Mouse,,
10/3/2018 20:29:25,,90,"TLR-11 and TLR-12 have an overlapping function in that both recognize protozoan parasites such as Toxoplasma gondii and Plasmodium falciparum. They bind to protein motifs that are present in the protozoan actin-binding protein profilin but absent in mammalian profilins. TLR-11 and TLR-12 are both required in macrophages and conventional dendritic cells for activation by T. gondii profilin, but TLR-12 plays a more dominant role.",Profilin,,,DC,TLR,,,Activate,,Antiparasitic,"TLR12 is mouse only. Target_Receptor = TLR11, TLR12",,,Mouse,,
10/3/2018 20:28:46,,90,"TLR-11 and TLR-12 have an overlapping function in that both recognize protozoan parasites such as Toxoplasma gondii and Plasmodium falciparum. They bind to protein motifs that are present in the protozoan actin-binding protein profilin but absent in mammalian profilins. TLR-11 and TLR-12 are both required in macrophages and conventional dendritic cells for activation by T. gondii profilin, but TLR-12 plays a more dominant role.",Profilin,,,Macrophage,TLR,,,Activate,,Antiparasitic,"TLR12 is mouse only. Target_Receptor = TLR11, TLR12",,,Mouse,,
10/3/2018 20:16:54,,89,Table Figure 3.10,Profilin,,,Macrophage,TLR,,,Activate,,Antiparasitic,"Source from toxoplasma gondii, unpathogenic bacteria. Target_Receptor = TLR12",,,Mouse,,
10/3/2018 20:17:07,,89,Table Figure 3.10,Profilin,,,DC,TLR,,,Activate,,Antiparasitic,"Source from toxoplasma gondii, unpathogenic bacteria. Target_Receptor = TLR12",,,Mouse,,
10/3/2018 20:17:23,,89,Table Figure 3.10,Profilin,,,Epithelial,TLR,,,Activate,,Antiparasitic,"Source from toxoplasma gondii, unpathogenic bacteria. Target_Receptor = TLR12",,,Mouse,,
10/3/2018 20:17:35,,89,Table Figure 3.10,Profilin,,,Hepatocyte,TLR,,,Activate,,Antiparasitic,"Source from toxoplasma gondii, unpathogenic bacteria. Target_Receptor = TLR12",,Liver,Mouse,,
10/22/2018 18:54:52,,463,"CCR3 and CCR4 are expressed both by TH2 cells and by eosinophils and basophils, as is CRTH2, the ligand for which is prostaglandin D2, a lipid mediator that is produced by activated tissue mast cells.",Prostaglandin D2,,,Th2,CRTH2,,,Recruit,,Type 2; Antiparasitic,,,Tissues,,,
10/22/2018 18:55:17,,463,"CCR3 and CCR4 are expressed both by TH2 cells and by eosinophils and basophils, as is CRTH2, the ligand for which is prostaglandin D2, a lipid mediator that is produced by activated tissue mast cells.",Prostaglandin D2,,,Eosinophil,CRTH2,,,Recruit,,Type 2; Antiparasitic,,,Tissues,,,
10/22/2018 18:55:34,,463,"CCR3 and CCR4 are expressed both by TH2 cells and by eosinophils and basophils, as is CRTH2, the ligand for which is prostaglandin D2, a lipid mediator that is produced by activated tissue mast cells.",Prostaglandin D2,,,Basophil,CRTH2,,,Recruit,,Type 2; Antiparasitic,,,Tissues,,,
12/5/2018 19:37:37,,615,"Prostaglandin D2 is the major prostaglandin produced by mast cells and recruits TH2 cells, eosinophils, and basophils, all of which express its receptor (PTGDR). Prostaglandin D2 is critical to the development of allergic diseases such as asthma, and polymorphisms in the PTGDR gene have been linked to an increased risk of developing asthma",Prostaglandin D2,,,Th2,PTGDR,,,Recruit,,Allergic Inflammation; Inflammation,,,,,Asthma; Allergy,
12/5/2018 19:37:53,,615,"Prostaglandin D2 is the major prostaglandin produced by mast cells and recruits TH2 cells, eosinophils, and basophils, all of which express its receptor (PTGDR). Prostaglandin D2 is critical to the development of allergic diseases such as asthma, and polymorphisms in the PTGDR gene have been linked to an increased risk of developing asthma",Prostaglandin D2,,,Eosinophil,PTGDR,,,Recruit,,Allergic Inflammation; Inflammation,,,,,Asthma; Allergy,
12/5/2018 19:38:08,,615,"Prostaglandin D2 is the major prostaglandin produced by mast cells and recruits TH2 cells, eosinophils, and basophils, all of which express its receptor (PTGDR). Prostaglandin D2 is critical to the development of allergic diseases such as asthma, and polymorphisms in the PTGDR gene have been linked to an increased risk of developing asthma",Prostaglandin D2,,,Basophil,PTGDR,,,Recruit,,Allergic Inflammation; Inflammation,,,,,Asthma; Allergy,
12/5/2018 19:19:40,,614,Table Figure 14.9,Prostaglandin D2,,,Eosinophil,,,,Recruit,,,,,,,,
12/5/2018 19:19:51,,614,Table Figure 14.9,Prostaglandin D2,,,Basophil,,,,Recruit,,,,,,,,
12/5/2018 19:20:00,,614,Table Figure 14.9,Prostaglandin D2,,,Th2,,,,Recruit,,,,,,,,
12/23/2018 Manual Split,,614,Table Figure 14.9,Prostaglandin E2,,,Eosinophil,,,,Recruit,,,,,,,,
12/23/2018 Manual Split,,614,Table Figure 14.9,Prostaglandin E2,,,Basophil,,,,Recruit,,,,,,,,
12/23/2018 Manual Split,,614,Table Figure 14.9,Prostaglandin E2,,,Th2,,,,Recruit,,,,,,,,
12/5/2018 19:34:16,,615,"The lipid mediators, in particular, can act both rapidly and persistently to cause smooth muscle contraction, increased vascular permeability, and the secretion of mucus, as well as induce the influx and activation of leukocytes, which contribute to allergic inflammation",Prostaglandins,,,Smooth muscle,,,,Activate,,Inflammation,,,,,,
12/5/2018 19:34:38,,615,"The lipid mediators, in particular, can act both rapidly and persistently to cause smooth muscle contraction, increased vascular permeability, and the secretion of mucus, as well as induce the influx and activation of leukocytes, which contribute to allergic inflammation",Prostaglandins,,,Endothelial_vascular,,,,Activate,,Inflammation; Vascular permeability increase,,,,,,
