Timestamp,Manual_Change,Ref_Page,Ref_Sentence,Source_Name,Source_Receptor,Source_State,Target_Name,Target_Receptor,Target_State,Product_Name,Edge_Effect,Edge_TargetProliferation,Edge_ImmuneProcess,Notes,Insufficient_Detail,Location,Species,Disease,
10/9/2018 19:36:59,,122,"Group 1 ILCs (ILC1s) generate IFN-? in response to activation by certain cytokines, in particular IL-12 and IL-18, made by dendritic cells and macrophages, and they function in protection against infection by viruses or intracellular pathogens.",DC,,,IL18,,,,Secrete,,Antiviral; Anti-IC bacteria,,,,,,
10/9/2018 19:54:21,,125,"NK cells that can kill sensitive targets can be isolated from uninfected individuals, but this activity is increased 20- to 100-fold when NK cells are exposed to IFN-à and IFN-?, or to IL-12, a cytokine produced by dendritic cells and macrophages during infection by many types of pathogens.",DC,,Activated,IL12,,,,Secrete,,Cytotoxicity,,,,,,
12/1/2018 13:34:52,,509,"In mice, unlike humans, a significant proportion of intestinal IgA is derived from T-cell-independent B-cell activation and class switching. This depends on activation of the innate immune system by the products of commensal microbes and may result from the direct interaction of B cells with conventional dendritic cells and follicular dendritic cells in solitary lymphoid follicles. This antibody production seems to involve lymphocytes of the B-1 subset (see Section 8-9), which arise from precursor B cells in the peritoneal cavity and migrate to the intestinal wall in response to microbial constituents such as lipopolysaccharide.",DC,,,B,,,IgA,Activate,,T independent B activation/IgA production,,,Gut,Mouse,,
10/18/2018 13:13:18,,362,"Activated dendritic cells also express very high levels of adhesion molecules, including DC-SIGN, and they secrete the chemokine CCL19, which specifically attracts naive T cells.",DC,,Activated,CCL19,,,,Secrete,,,,,,,,
10/18/2018 13:31:56,,363,"Activation of plasmacytoid dendritic cells through TLR-9 induces the expression of CD40 ligand (CD40L or CD154), a TNF-family transmembrane cytokine, which binds to CD40, a TNF-family receptor that is expressed by  activated conventional dendritic cells. This interaction enables conventional dendritic cells to sustain production of the pro-inflammatory cytokine IL-12, strengthening the IL-12-induced production of IFN-? by T cells.",DC,,Activated,IL12,,,,Secrete,,Antibacterial,,,,,,
10/18/2018 13:25:27,,363,"Normally, IL-12 made by conventional dendritic cells induces CD4 T cells to produce abundant IFN-?, which helps macrophages kill the bacteria.",DC,,,IL12,,,,Secrete,,Anti-IC bacteria,,,,,,
11/20/2018 10:22:37,,500,"During activation, and under the selective control of gut-derived dendritic cells, the T cells lose L-selectin and acquire the chemokine receptor CCR9 and the integrin à4:?7.",DC,,,T (effector),,Activated,CCR9 expression on T,Activate,,,,Target_Name,Gut,,,
11/20/2018 11:12:47,,504,"The induction of regulatory T cells in intestinal tissues is assisted by transforming growth factor-? (TGF-?), which is produced by dendritic cells.",DC,,,TGFb,,,,Secrete,,Tolerance,Gut tolerance,,Gut,,,
10/18/2018 14:15:13,Source_Name,368,Figure 9.22,DC,,,IL6,,,,Secrete,,,,,,,,
10/18/2018 14:15:26,Source_Name,368,Figure 9.22,DC,,,IL12,,,,Secrete,,,,,,,,
10/18/2018 14:15:36,Source_Name,368,Figure 9.22,DC,,,IL23,,,,Secrete,,,,,,,,
10/18/2018 14:15:45,Source_Name,368,Figure 9.22,DC,,,IL4,,,,Secrete,,,,,,,,
10/18/2018 14:24:35,Source_Name,369,"The initial encounter with specific antigen in the presence of a co-stimulatory signal triggers entry of the T cell into the G1 phase of the cell cycle; at the same time, it also induces the synthesis of IL-2 along with the à chain of the IL-2 receptor (also known as CD25).",DC,,,T_CD4,,,IL2,Activate,Yes,,,,,,,
10/18/2018 14:24:45,Source_Name,369,"The initial encounter with specific antigen in the presence of a co-stimulatory signal triggers entry of the T cell into the G1 phase of the cell cycle; at the same time, it also induces the synthesis of IL-2 along with the à chain of the IL-2 receptor (also known as CD25).",DC,,,T_CD8,,,IL2,Activate,Yes,,,,,,,
11/20/2018 11:19:07,,505,"The anti-inflammatory behavior of mucosal dendritic cells in the healthy gut is promoted by factors that are constitutively produced in the mucosal environment. These include thymic stromal lymphopoietin (TSLP), TGF-? produced by dendritic and epithelial cells, prostaglandin PGE2 produced by stromal cells, and IL-10 produced by intestinal macrophages and CD4 T cells.",DC,,,TGFb,,,,Secrete,,Tolerance,Gut tolerance,,Gut,,,
10/18/2018 15:05:49,,372,"In some viral infections, dendritic cells become sufficiently activated to directly induce CD8 T cells to produce the IL-2 required for their differentiation into cytotoxic effector cells, without help from CD4 T cells.",DC,,,T_CD8,,,IL2,Activate,,,,,,,,
10/19/2018 10:24:04,,375,"IL-6 produced by dendritic cells acts with transforming growth factor-? (TGF-?) to induce differentiation of TH17 cells, which upregulate expression of the IL-23 receptor and become responsive to IL-23.",DC,,,IL6,,,,Secrete,,Type 3,,,,,,
10/19/2018 10:29:02,,376,"These T cells are now committed to becoming TH1 cells, and can be further activated by IL-12 produced by dendritic cells and macrophages to induce STAT4 signaling.",DC,,,IL12,,,,Secrete,,Type 1,,,,,,
10/19/2018 19:11:37,,378,"Thus, certain intracellular bacterial infections (for example, mycobacteria and Listeria) induce dendritic cells and macrophages to produce IL-12, favoring the emergence of TH1 effector cells.",DC,,,IL12,,,,Secrete,,Antibacterial,,,,,,
12/4/2018 14:26:02,,514,"Its unique features include distinctive routes and processes for the uptake and presentation of antigens, exploitation of M cells to transport antigens across the epithelium of Peyer?s patches, and retinoic acid-producing dendritic cells that imprint the T and B cells they activate with gut-homing properties.",DC,,,Retinoic acid,,,,Secrete,,,,,Gut,,,
12/4/2018 15:16:55,,518,"As described in Section 9-8, activated dendritic cells will express high levels of co-stimulatory molecules and cytokines such as IL-1, IL-6, IL-12, and IL-23, and promote development of effector T cells.",DC,,Activated,IL1,,,,Secrete,,,,,Gut,,,
12/4/2018 15:17:11,,518,"As described in Section 9-8, activated dendritic cells will express high levels of co-stimulatory molecules and cytokines such as IL-1, IL-6, IL-12, and IL-23, and promote development of effector T cells.",DC,,Activated,IL6,,,,Secrete,,,,,Gut,,,
12/4/2018 15:17:20,,518,"As described in Section 9-8, activated dendritic cells will express high levels of co-stimulatory molecules and cytokines such as IL-1, IL-6, IL-12, and IL-23, and promote development of effector T cells.",DC,,Activated,IL12,,,,Secrete,,,,,Gut,,,
12/4/2018 15:17:29,,518,"As described in Section 9-8, activated dendritic cells will express high levels of co-stimulatory molecules and cytokines such as IL-1, IL-6, IL-12, and IL-23, and promote development of effector T cells.",DC,,Activated,IL23,,,,Secrete,,,,,Gut,,,
10/19/2018 21:18:43,,402,"CD4 T cells specific for such viral peptides may have been activated by dendritic cells earlier in the infection, and some will have differentiated into TFH cells.",DC,,,T_CD4,,,,Activate,,,,,,,,
12/4/2018 16:37:09,,523,"Flagellin present on many intestinal bacterial species can stimulate TLR-5 on mucosal CD11b-expressing dendritic cells, inducing the production of IL-6 and IL-23 and favoring TH17 and IgA responses.",DC,,Activated,IL6,,,,Secrete,,Type 3,,,Gut,,,
12/4/2018 16:37:20,,523,"Flagellin present on many intestinal bacterial species can stimulate TLR-5 on mucosal CD11b-expressing dendritic cells, inducing the production of IL-6 and IL-23 and favoring TH17 and IgA responses.",DC,,Activated,IL23,,,,Secrete,,Type 3,,,Gut,,,
12/4/2018 16:44:45,,524,Figure 12.23,DC,,Activated,IL1,,,,Secrete,,Microbiome tuning of immune response; Type 3,,,Gut,,,
12/4/2018 16:45:23,,524,Figure 12.23,DC,,Activated,IL6,,,,Secrete,,Microbiome tuning of immune response; Type 3,,,Gut,,,
12/4/2018 16:45:32,,524,Figure 12.23,DC,,Activated,IL23,,,,Secrete,,Microbiome tuning of immune response; Type 3,,,Gut,,,
10/19/2018 23:22:21,,421,"Dendritic cells and macrophages can provide co-stimulatory signals for activation of B cells by TI-2 antigens. One of these co-stimulatory signals is BAFF, which can be secreted by dendritic cells and interacts with the receptor TACI on the B cell (see Fig. 10.25, right panels).",DC,,,BAFF,,,,Secrete,,,,,,,,
10/20/2018 17:09:28,,451,"As discussed in Chapter 3, ILC1s and related NK cells are characterized by their production of IFN-? in response to IL-12 and IL-18 produced by pathogen-activated dendritic cells and macrophages.",DC,,Activated,IL12,,,,Secrete,,Type 1,,,,,,
10/20/2018 17:09:37,,451,"As discussed in Chapter 3, ILC1s and related NK cells are characterized by their production of IFN-? in response to IL-12 and IL-18 produced by pathogen-activated dendritic cells and macrophages.",DC,,Activated,IL18,,,,Secrete,,Type 1,,,,,,
10/24/2018 12:37:02,,465,"As discussed in Chapter 9, the development of TH17 cells is induced by the combined actions of TGF-? and the pro-inflammatory cytokines IL-6, IL-1, and IL-23 (see Fig. 9.31). The latter is preferentially produced by CD103+CD11b+ conventional dendritic cells that recognize MAMPs produced by extracellular bacteria, such as flagellin, which is recognized by TLR5; or MAMPs produced by fungi, such as ?-glucan polymers of glucose expressed by yeast and fungi that are recognized by Dectin-1.",DC,,,IL23,,,,Secrete,,Anti-EC bacteria; Antifungal,,,,,,
11/20/2018 11:46:44,,508,"Uptake of IgA:antigen complexes by dendritic cells also induces these cells to produce anti-inflammatory IL-10. Together these properties mean that IgA can limit the penetration of microbes into the mucosa without risking inflammatory damage to these fragile tissues, something that would be potentially harmful in the intestine.",DC,,Activated,IL10,,,,Secrete,,Anti-inflammatory,,,Intestine; Mucosa,,,
11/7/2018 23:42:40,,470,Cytokines IL-12 and IL-18 made by dendritic cells can induce bystander CD8 T cells to produce IFN-g  And Figure 11.21,DC,,Activated,IL12,,,,Secrete,,Licensing,,,,,,
11/7/2018 23:43:29,,470,Cytokines IL-12 and IL-18 made by dendritic cells can induce bystander CD8 T cells to produce IFN-g  And Figure 11.21,DC,,Activated,IL18,,,,Secrete,,Licensing,,,,,,
11/7/2018 23:48:35,,470,"Right panels: activated dendritic cells also produce the cytokines IL-12 and IL-18, whose combined effect on CD8 T cells rapidly induces the production of IFN-? (upper right panel). This activates macrophages for the destruction of intracellular bacteria and can promote antiviral responses in other cells (lower right panel).",DC,,Activated,IL12,,,,Secrete,,Licensing; Antibacterial; Antiviral,,,,,,
11/7/2018 23:48:45,,470,"Right panels: activated dendritic cells also produce the cytokines IL-12 and IL-18, whose combined effect on CD8 T cells rapidly induces the production of IFN-? (upper right panel). This activates macrophages for the destruction of intracellular bacteria and can promote antiviral responses in other cells (lower right panel).",DC,,Activated,IL18,,,,Secrete,,Licensing; Antibacterial; Antiviral,,,,,,
12/1/2018 22:24:43,,510,"In response to IL-23 secreted by local dendritic cells, ILC3s produce IL-22, which stimulates the epithelium to generate antimicrobial peptides that promote local defense against bacterial and fungal pathogens in the intestine.",DC,,,IL23,,,,Secrete,,Antibacterial; Antifungal,,,Lamina propria,,,
10/17/2018 15:18:18,,351,"CCL21 is produced by stromal cells of T-cell zones in secondary lymphoid tissues, and is displayed on endothelial cells of high endothelial venules (HEVs). Another source of CCL21 is interdigitating dendritic cells, which also produce CCL19 and are prominent in T-cell zones.",DC,,,CCL21,,,,Secrete,,,,,LN,,,
10/17/2018 15:18:29,,351,"CCL21 is produced by stromal cells of T-cell zones in secondary lymphoid tissues, and is displayed on endothelial cells of high endothelial venules (HEVs). Another source of CCL21 is interdigitating dendritic cells, which also produce CCL19 and are prominent in T-cell zones.",DC,,,CCL19,,,,Secrete,,,,,LN,,,
10/17/2018 15:20:32,,351,"This organization would then be reinforced by CCL21 and CCL19 secreted by resident dendritic cells, which in turn attract more T cells and migratory dendritic cells.",DC,,,CCL21,,,,Secrete,,,,,LN,,,
10/17/2018 15:20:42,,351,"This organization would then be reinforced by CCL21 and CCL19 secreted by resident dendritic cells, which in turn attract more T cells and migratory dendritic cells.",DC,,,CCL19,,,,Secrete,,,,,LN,,,
10/17/2018 15:34:03,,354,"The extravasation of naive T cells is prompted by the chemokine CCL21, which is expressed by vascular high endothelial cells and the  stromal cells of lymphoid tissues, as well as by dendritic cells that reside in T-cell zones. It binds to the chemokine receptor CCR7 on naive T cells, stimulating activation of the intracellular receptor-associated G-protein subunit Gài.",DC,,,CCL21,,,,Secrete,,,T extravasation/recruitment to LN,,LN,,,
10/17/2018 15:35:01,,355,"Once naive T cells have arrived in the T-cell zone via high endothelial venules, CCR7 directs their retention in this location, as they are attracted to dendritic cells that produce CCL21 and CCL19 in the T-cell zone.",DC,,,CCL21,,,,Secrete,,,,,LN,,,
10/17/2018 15:35:11,,355,"Once naive T cells have arrived in the T-cell zone via high endothelial venules, CCR7 directs their retention in this location, as they are attracted to dendritic cells that produce CCL21 and CCL19 in the T-cell zone.",DC,,,CCL19,,,,Secrete,,,,,LN,,,
10/17/2018 15:44:08,Target_Name,358,"Dendritic cells take up, process, and present antigens from all types of sources, and are present mainly in the T-cell areas where they drive the initial clonal expansion and   differentiation of naive T cells into effector T cells.",DC,,,T_CD4,,,T_CD4 (effector),Activate,Yes,,,,LN,,,
10/17/2018 15:44:17,Target_Name,358,"Dendritic cells take up, process, and present antigens from all types of sources, and are present mainly in the T-cell areas where they drive the initial clonal expansion and   differentiation of naive T cells into effector T cells.",DC,,,T_CD8,,,T_Cytotoxic,Activate,Yes,,,,LN,,,
10/18/2018 13:04:57,,361,Figure 9.17,DC,,Activated,CCL18,,,,Secrete,,,,,LN,,,
10/19/2018 21:26:51,,403,"Once in the follicle, naive B cells encounter the soluble TNF-family cytokine BAFF (see Section 8-8), which is secreted by FDCs, stromal cells, and dendritic cells and which acts as a survival factor for B cells.",DC,,,BAFF,,,,Secrete,,,,,LN,,,
12/4/2018 22:05:39,,603,Figure 14.2,DC,,,T_CD4,,,Th2,Polarize,,Allergic Inflammation; Type 2,,,LN,,Allergy,
12/4/2018 22:17:00,,604,"Immune defenses against multicellular parasites are found mainly at the sites of parasite entry, namely, under the skin and in the mucosal tissues of the airways and the gut. Cells of the innate and adaptive immune systems at these sites are specialized to secrete cytokines that promote a type 2 response to parasitic infection. In the presence of an invading parasite, dendritic cells taking up antigens in these tissues migrate to regional lymph nodes, where they tend to drive antigen-specific naive CD4 T cells to become effector TH2 cells. TH2 cells themselves secrete IL-4, IL-5, IL-9, and IL-13, thus maintaining an environment in which further differentiation of TH2 cells is favored. The cytokine IL-33, which can be produced by activated mast cells and by damaged or injured epithelial cells, also contributes to amplification of the TH2 response. IL-33 can act directly on TH2 cells via the IL-33 receptors that these cells express.",DC,,,T_CD4,,,Th2,Polarize,,Antiparasitic; Type 2,,,LN,,,
10/17/2018 14:41:23,,350,"Dendritic cells with CCR7?a receptor for CCL21?are attracted to the site of the developing lymph node by CCL21 (second panel); it is not known whether at the earliest stages of lymph-node development immature dendritic cells enter from the bloodstream or via the lymphatics, as they do later in life. once in the lymph node, the dendritic cells express the chemokine CCL19, which is also bound by CCR7.",DC,,,CCL19,,,CCL19,Secrete,,LN development,,,Developing LN,,,
10/17/2018 14:47:43,,350,"Dendritic cells secrete CCL19, which attracts T cells to the developing lymph node",DC,,,CCL19,,,,Secrete,,LN development,,,Developing LN,,,
10/19/2018 21:24:01,,403,"Naive T cells express the chemokine receptor CCR7, and localize to zones where its ligands, CCL19 and CCL21, are highly expressed by stromal cells and dendritic cells (see Section 9-3).",DC,,,CCL21,,,,Secrete,,,,,LO,,,
10/19/2018 21:24:13,,403,"Naive T cells express the chemokine receptor CCR7, and localize to zones where its ligands, CCL19 and CCL21, are highly expressed by stromal cells and dendritic cells (see Section 9-3).",DC,,,CCL19,,,,Secrete,,,,,LO,,,
11/20/2018 11:03:38,,503,"In mice, the most abundant subset of dendritic cells in the Peyer?s patch expresses CD11b (àM integrin) and, when activated, tends to produce IL-23. This promotes development of TH17 cells and stimulates ILC3 cells, both of which produce IL-17 and IL-22 (see Sections 3-23 and 11-2). These dendritic cells express CCR6, the receptor for CCL20 produced by follicle-associated epithelial cells. In resting conditions, they reside beneath the epithelium and produce IL-10 in response to antigen uptake, maintaining a noninflammatory environment.",DC,,Unactivated,IL10,,,,Secrete,,Tolerance,Gut tolerance,,Intestinal epithelium,,,
10/19/2018 19:48:25,,379,"As will be discussed in more detail in Chapter 12, the differentiation of induced Treg cells in the intestines is favored by the presence of antigen-presenting cells that produce retinoic acid, which is derived from vitamin A. Retinoic acid produced by intestinal dendritic cells acts with TGF-? to induce Treg differentiation while suppressing the differentiation of TH17 cells (see Fig. 9.33).",DC,,,Retinoic acid,,,,Secrete,,Tolerance,Tolerance to intestinal microbiota,,Intestine,,,
10/21/2018 20:37:22,,545,"TACI is the receptor for the cytokines BAFF and APRIL, which are produced by T cells, dendritic cells, and macrophages, and which can provide co-stimulatory and survival signals for B-cell activation and class switching (see Section 10-3).",DC,,,APRIL,,,,Secrete,,Class switching,,,,,,
10/21/2018 20:37:35,,545,"TACI is the receptor for the cytokines BAFF and APRIL, which are produced by T cells, dendritic cells, and macrophages, and which can provide co-stimulatory and survival signals for B-cell activation and class switching (see Section 10-3).",DC,,,BAFF,,,,Secrete,,Class switching,,,,,,
10/22/2018 18:51:51,,462,"Dendritic cells required for the presentation of helminth antigens to naive CD4 T cells appear to be activated by IL-13 produced by ILC2 cells and innate cytokines, such as epithelium-derived TSLP, which repress the development of TH1- and TH17-inducing dendritic cells in favor of dendritic cells that promote TH2 cell differentiation.",DC,,,T_CD4,,,Th2,Polarize,,Antiparasitic,,,,,,
11/20/2018 10:59:39,,503,"In mice, the most abundant subset of dendritic cells in the Peyer?s patch expresses CD11b (àM integrin) and, when activated, tends to produce IL-23. This promotes development of TH17 cells and stimulates ILC3 cells, both of which produce IL-17 and IL-22 (see Sections 3-23 and 11-2).",DC,,Activated,IL23,,,,Secrete,,,,,Peyers patch,,,
12/6/2018 15:09:49,,632,"Allergic contact dermatitis can be caused by the activation of CD4 or CD8 T cells, depending on the pathway by which the antigen is processed... During the sensitization phase, Langerhans cells in the epidermis and dendritic cells in the dermis take up and process antigen, and migrate to regional lymph nodes, where they activate T cells (see Fig. 9.13) with the  consequent production of memory T cells, which localize in the dermis. In the elicitation phase, a subsequent exposure to the sensitizing chemical leads to antigen presentation to memory T cells in the dermis, with the release of T-cell cytokines such as IFN-? and IL-17. This stimulates the keratinocytes of the epidermis to release IL-1, IL-6, TNF-à, GM-CSF, the chemokine CXCL8, and the interferon-inducible chemokines CXCL11 (IP-9), CXCL10 (IP-10), and CXCL9 (Mig, a monokine induced by IFN-?). These cytokines and chemokines enhance the inflammatory response by inducing the migration of  monocytes into the lesion and their maturation into macrophages, and by attracting more T cells",DC,,,T (memory),,,"IFNg, IL17",Activate,,,Target_Name can be CD4 or CD8,Target_Name,Skin,,allergy (contact dermatitis),
10/7/2018 12:55:05,,811,Table Appendix III,DC,,,IFNa,,,,Secrete,,Antiviral; Antigen presentation,,,,,,
10/7/2018 13:24:47,,811,Table Appendix III,DC,,,IL10,,,,Secrete,,Immunosuppression,,,,,,
10/7/2018 13:30:07,,811,Table Appendix III,DC,,,IL12,,,,Secrete,,,,,,,,
10/7/2018 16:23:13,,812,Table Appendix III,DC,,,IL28,,,,Secrete,,Antiviral,,,,,,
10/7/2018 16:23:29,,812,Table Appendix III,DC,,,IL29,,,,Secrete,,Antiviral,,,,,,
10/7/2018 16:22:30,,812,Table Appendix III,DC,,,IL27,,,,Secrete,,,,,,,,
10/7/2018 16:18:09,,812,Table Appendix III,DC,,,IL23,,,,Secrete,,,,,,,,
11/20/2018 11:10:20,,504,"Both the generation of Treg cells and their expression of gut-homing molecules require that the dendritic cells produce retinoic acid, which is derived from the metabolism of dietary vitamin A through the action of retinal dehydrogenases.",DC,,,Retinoic acid,,,Treg,Secrete,,Tolerance,ONLY in small intestine. Gut tolerance,,Small intestine,,,
10/7/2018 16:29:39,,813,Table Appendix III,DC,,,IL37,,,,Secrete,,,suppresses DC/monocyte production of IL1/6/12 etc cytokines; synergizes with TGFs,,,,,
11/20/2018 11:12:13,,504,"Retinoic acid-producing dendritic cells are also found in Peyer?s patches, and may also be important for generating regulatory T cells either in the Peyer?s patch itself, or after they migrate to the mesenteric lymph node.",DC,,,Retinoic acid,,,Treg,Secrete,,Tolerance,Gut tolerance,,Small intestine; Peyers patch,,,
11/20/2018 11:06:09,,503,"Also in the T-cell area of Peyer?s patches are the less abundant CD11b-negative subset of dendritic cells, whose development requires the factor BATF3 and which produce the cytokine IL-12 (see Sections 6-5 and 9-9). CD11b-expressing dendritic cells are protective in many intestinal infections.",DC (CD11b-),,,IL12,,,,Secrete,,Antimicrobial,,,Peyers patch,,,
11/7/2018 23:02:27,,468,"During this intestinal phase of infection, much of the T-cell response appears to be directed against  antigenic epitopes within bacterial flagellins, which are potent activators of TLR5. Activation of this innate sensor promotes IL-23 expression by CD11b  classical dendritic cells in the intestine, and thereby induces a type 3 immune response.",DC (CD11b+),,,IL23,,,,Secrete,,Antibacterial; Type 3,,,Intestine,,Salmonella infection,
11/7/2018 23:04:58,,469,"Some of these newly expressed antigens appear to activate cytosolic sensors within CD8à+ classical dendritic cells, which produce IL-12 to activate pathogen-specific TH1 cells and a type 1 response.",DC (CD8a+),,,IL12,,,,Secrete,,Type 1; Antibacterial,,,Intestine,,Salmonella infection,
10/18/2018 13:23:15,,362,"Similarly, some viruses are recognized by TLRs inside the dendritic cell via double-stranded RNA produced during viral replication.",dsRNA,,,DC,TLR,,,Activate,,Antiviral,,,,,,
10/3/2018 16:50:33,,89,Table Figure 3.10,dsRNA,,,Macrophage,TLR,,,Activate,,Antiviral,Target_Receptor = TLR3,,,,,
10/3/2018 16:50:47,,89,Table Figure 3.10,dsRNA,,,DC,TLR,,,Activate,,Antiviral,Target_Receptor = TLR3,,,,,
10/3/2018 16:51:15,,89,Table Figure 3.10,dsRNA,,,Epithelial_intestine,TLR,,,Activate,,Antiviral,Target_Receptor = TLR3,,,,,
10/3/2018 20:31:36,,91,"TLR-3 is expressed by macrophages, conventional dendritic cells, and intestinal epithelial cells; it recognizes double-stranded RNA (dsRNA), which is a replicative intermediate of many types of viruses, not only those with RNA genomes.",dsRNA,,,Macrophage,TLR,,,Activate,,Antiviral,Target_Receptor = TLR3,,,,,
10/3/2018 20:31:51,,91,"TLR-3 is expressed by macrophages, conventional dendritic cells, and intestinal epithelial cells; it recognizes double-stranded RNA (dsRNA), which is a replicative intermediate of many types of viruses, not only those with RNA genomes.",dsRNA,,,DC,TLR,,,Activate,,Antiviral,Target_Receptor = TLR3,,,,,
10/3/2018 20:32:05,,91,"TLR-3 is expressed by macrophages, conventional dendritic cells, and intestinal epithelial cells; it recognizes double-stranded RNA (dsRNA), which is a replicative intermediate of many types of viruses, not only those with RNA genomes.",dsRNA,,,Epithelial_intestine,TLR,,,Activate,,Antiviral,Target_Receptor = TLR3,,,,,
10/9/2018 13:02:42,,112,Table Figure 3.28,Endothelial,,,CCL4,,,,Secrete,,Antiviral,CCL4 competes with HIV,,,,,
10/9/2018 13:07:11,,112,Table Figure 3.28,Endothelial,,,CCL5,,,,Secrete,,Inflammation,,,,,,
10/9/2018 13:10:23,,112,Table Figure 3.28,Endothelial,,,CX3CL1,,,,Secrete,,Inflammation,Involved in leukocyte-endothelial adhesion,,,,,
10/9/2018 12:47:40,,112,Table Figure 112,Endothelial,,,CXCL8,,,,Secrete,,Inflammation; Angiogenesis,"CXCL8 mobilizes, activates, and degranulates neutrophils",,,,,
10/17/2018 14:40:07,,350,"The cellular organization of lymphoid organs is initiated by stromal cells and vascular endothelial cells, which secrete the chemokine CCL21 (first panel).",Endothelial,,,CCL21,,,,Secrete,,LN development,,,Developing LN,,,
10/7/2018 13:16:40,,811,Table Appendix III,Endothelial,,,IL6,,,,Secrete,,Acute phase response; Fever,,,,,,
